SQL> create table customer (
  2     customer_id   number(10) primary key,
  3     customer_name varchar2(50) not null,
  4     email         varchar2(100) unique not null,
  5     phone_no      varchar2(15) unique not null,
  6     dob           date,
  7     address       varchar2(150) not null
  8  );

Table created.

SQL> insert into customer values
  2     ( 101,
  3       'Arun Kumar',
  4       'arun@gmail.com',
  5       '9876543210',
  6       '12-MAY-1998',
  7       'Chennai' );

1 row created.

SQL> insert into customer values
  2     ( 102,
  3       'Priya Sharma',
  4       'priya@gmail.com',
  5       '9876543211',
  6       '19-AUG-1999',
  7       'Bangalore' );

1 row created.

SQL> insert into customer values
  2     ( 103,
  3       'Rahul Singh',
  4       'rahul@gmail.com',
  5       '9876543212',
  6       '17-MAR-1997',
  7       'Hyderabad' );

1 row created.

SQL> insert into customer values
  2     ( 104,
  3       'Sneha Reddy',
  4       'sneha@gmail.com',
  5       '9876543213',
  6       '20-NOV-2010',
  7       'Mumbai' );

1 row created.

SQL> insert into customer values
  2     ( 105,
  3       'Vikram Patel',
  4       'vikram@gmail.com',
  5       '9876543214',
  6       '18-JUL-1987',
  7       'Ahmedabad' );

1 row created.

SQL> insert into customer values
  2     ( 106,
  3       'Anjali Das',
  4       'anjali@gmail.com',
  5       '9876543215',
  6       '25-JAN-2005',
  7       'Kolkata' );

1 row created.

SQL> insert into customer values
  2     ( 107,
  3       'Karan Mehta',
  4       'karan@gmail.com',
  5       '9876543216',
  6       '30-JAN-1995',
  7       'Pune' );

1 row created.

SQL> insert into customer values
  2     ( 108,
  3       'Meera Nair',
  4       'meera@gmail.com',
  5       '9876543217',
  6       '22-APR-2007',
  7       'Kochi' );

1 row created.

SQL> insert into customer values
  2     ( 109,
  3       'Rohan Gupta',
  4       'rohan@gmail.com',
  5       '9876543218',
  6       '19-DEC-2008',
  7       'Delhi' );

1 row created.

SQL> insert into customer values
  2     ( 110,
  3       'Divya Iyer',
  4       'divya@gmail.com',
  5       '9876543219',
  6       '16-JUN-2009',
  7       'Coimbatore' );

1 row created.

SQL> select *
  2    from customer;

CUSTOMER_ID CUSTOMER_NAME
----------- --------------------------------------------------
EMAIL
--------------------------------------------------------------------------------
PHONE_NO        DOB
--------------- ---------
ADDRESS
--------------------------------------------------------------------------------
        101 Arun Kumar
arun@gmail.com
9876543210      12-MAY-98
Chennai


CUSTOMER_ID CUSTOMER_NAME
----------- --------------------------------------------------
EMAIL
--------------------------------------------------------------------------------
PHONE_NO        DOB
--------------- ---------
ADDRESS
--------------------------------------------------------------------------------
        102 Priya Sharma
priya@gmail.com
9876543211      19-AUG-99
Bangalore


CUSTOMER_ID CUSTOMER_NAME
----------- --------------------------------------------------
EMAIL
--------------------------------------------------------------------------------
PHONE_NO        DOB
--------------- ---------
ADDRESS
--------------------------------------------------------------------------------
        103 Rahul Singh
rahul@gmail.com
9876543212      17-MAR-97
Hyderabad


CUSTOMER_ID CUSTOMER_NAME
----------- --------------------------------------------------
EMAIL
--------------------------------------------------------------------------------
PHONE_NO        DOB
--------------- ---------
ADDRESS
--------------------------------------------------------------------------------
        104 Sneha Reddy
sneha@gmail.com
9876543213      20-NOV-10
Mumbai


CUSTOMER_ID CUSTOMER_NAME
----------- --------------------------------------------------
EMAIL
--------------------------------------------------------------------------------
PHONE_NO        DOB
--------------- ---------
ADDRESS
--------------------------------------------------------------------------------
        105 Vikram Patel
vikram@gmail.com
9876543214      18-JUL-87
Ahmedabad


CUSTOMER_ID CUSTOMER_NAME
----------- --------------------------------------------------
EMAIL
--------------------------------------------------------------------------------
PHONE_NO        DOB
--------------- ---------
ADDRESS
--------------------------------------------------------------------------------
        106 Anjali Das
anjali@gmail.com
9876543215      25-JAN-05
Kolkata


CUSTOMER_ID CUSTOMER_NAME
----------- --------------------------------------------------
EMAIL
--------------------------------------------------------------------------------
PHONE_NO        DOB
--------------- ---------
ADDRESS
--------------------------------------------------------------------------------
        107 Karan Mehta
karan@gmail.com
9876543216      30-JAN-95
Pune


CUSTOMER_ID CUSTOMER_NAME
----------- --------------------------------------------------
EMAIL
--------------------------------------------------------------------------------
PHONE_NO        DOB
--------------- ---------
ADDRESS
--------------------------------------------------------------------------------
        108 Meera Nair
meera@gmail.com
9876543217      22-APR-07
Kochi


CUSTOMER_ID CUSTOMER_NAME
----------- --------------------------------------------------
EMAIL
--------------------------------------------------------------------------------
PHONE_NO        DOB
--------------- ---------
ADDRESS
--------------------------------------------------------------------------------
        109 Rohan Gupta
rohan@gmail.com
9876543218      19-DEC-08
Delhi


CUSTOMER_ID CUSTOMER_NAME
----------- --------------------------------------------------
EMAIL
--------------------------------------------------------------------------------
PHONE_NO        DOB
--------------- ---------
ADDRESS
--------------------------------------------------------------------------------
        110 Divya Iyer
divya@gmail.com
9876543219      16-JUN-09
Coimbatore


10 rows selected.

SQL> update customer
  2     set
  3     customer_name = 'Arun Raj'
  4   where customer_id = 101;

1 row updated.

SQL> select *
  2    from customer;

CUSTOMER_ID CUSTOMER_NAME
----------- --------------------------------------------------
EMAIL
--------------------------------------------------------------------------------
PHONE_NO        DOB
--------------- ---------
ADDRESS
--------------------------------------------------------------------------------
        101 Arun Raj
arun@gmail.com
9876543210      12-MAY-98
Chennai


CUSTOMER_ID CUSTOMER_NAME
----------- --------------------------------------------------
EMAIL
--------------------------------------------------------------------------------
PHONE_NO        DOB
--------------- ---------
ADDRESS
--------------------------------------------------------------------------------
        102 Priya Sharma
priya@gmail.com
9876543211      19-AUG-99
Bangalore


CUSTOMER_ID CUSTOMER_NAME
----------- --------------------------------------------------
EMAIL
--------------------------------------------------------------------------------
PHONE_NO        DOB
--------------- ---------
ADDRESS
--------------------------------------------------------------------------------
        103 Rahul Singh
rahul@gmail.com
9876543212      17-MAR-97
Hyderabad


CUSTOMER_ID CUSTOMER_NAME
----------- --------------------------------------------------
EMAIL
--------------------------------------------------------------------------------
PHONE_NO        DOB
--------------- ---------
ADDRESS
--------------------------------------------------------------------------------
        104 Sneha Reddy
sneha@gmail.com
9876543213      20-NOV-10
Mumbai


CUSTOMER_ID CUSTOMER_NAME
----------- --------------------------------------------------
EMAIL
--------------------------------------------------------------------------------
PHONE_NO        DOB
--------------- ---------
ADDRESS
--------------------------------------------------------------------------------
        105 Vikram Patel
vikram@gmail.com
9876543214      18-JUL-87
Ahmedabad


CUSTOMER_ID CUSTOMER_NAME
----------- --------------------------------------------------
EMAIL
--------------------------------------------------------------------------------
PHONE_NO        DOB
--------------- ---------
ADDRESS
--------------------------------------------------------------------------------
        106 Anjali Das
anjali@gmail.com
9876543215      25-JAN-05
Kolkata


CUSTOMER_ID CUSTOMER_NAME
----------- --------------------------------------------------
EMAIL
--------------------------------------------------------------------------------
PHONE_NO        DOB
--------------- ---------
ADDRESS
--------------------------------------------------------------------------------
        107 Karan Mehta
karan@gmail.com
9876543216      30-JAN-95
Pune


CUSTOMER_ID CUSTOMER_NAME
----------- --------------------------------------------------
EMAIL
--------------------------------------------------------------------------------
PHONE_NO        DOB
--------------- ---------
ADDRESS
--------------------------------------------------------------------------------
        108 Meera Nair
meera@gmail.com
9876543217      22-APR-07
Kochi


CUSTOMER_ID CUSTOMER_NAME
----------- --------------------------------------------------
EMAIL
--------------------------------------------------------------------------------
PHONE_NO        DOB
--------------- ---------
ADDRESS
--------------------------------------------------------------------------------
        109 Rohan Gupta
rohan@gmail.com
9876543218      19-DEC-08
Delhi


CUSTOMER_ID CUSTOMER_NAME
----------- --------------------------------------------------
EMAIL
--------------------------------------------------------------------------------
PHONE_NO        DOB
--------------- ---------
ADDRESS
--------------------------------------------------------------------------------
        110 Divya Iyer
divya@gmail.com
9876543219      16-JUN-09
Coimbatore


10 rows selected.

SQL> update customer
  2     set
  3     email = 'arunraj@gmail.com'
  4   where customer_id = 101;

1 row updated.

SQL> select *        
  2    from customer;

CUSTOMER_ID CUSTOMER_NAME
----------- --------------------------------------------------
EMAIL
--------------------------------------------------------------------------------
PHONE_NO        DOB
--------------- ---------
ADDRESS
--------------------------------------------------------------------------------
        101 Arun Raj
arunraj@gmail.com
9876543210      12-MAY-98
Chennai


CUSTOMER_ID CUSTOMER_NAME
----------- --------------------------------------------------
EMAIL
--------------------------------------------------------------------------------
PHONE_NO        DOB
--------------- ---------
ADDRESS
--------------------------------------------------------------------------------
        102 Priya Sharma
priya@gmail.com
9876543211      19-AUG-99
Bangalore


CUSTOMER_ID CUSTOMER_NAME
----------- --------------------------------------------------
EMAIL
--------------------------------------------------------------------------------
PHONE_NO        DOB
--------------- ---------
ADDRESS
--------------------------------------------------------------------------------
        103 Rahul Singh
rahul@gmail.com
9876543212      17-MAR-97
Hyderabad


CUSTOMER_ID CUSTOMER_NAME
----------- --------------------------------------------------
EMAIL
--------------------------------------------------------------------------------
PHONE_NO        DOB
--------------- ---------
ADDRESS
--------------------------------------------------------------------------------
        104 Sneha Reddy
sneha@gmail.com
9876543213      20-NOV-10
Mumbai


CUSTOMER_ID CUSTOMER_NAME
----------- --------------------------------------------------
EMAIL
--------------------------------------------------------------------------------
PHONE_NO        DOB
--------------- ---------
ADDRESS
--------------------------------------------------------------------------------
        105 Vikram Patel
vikram@gmail.com
9876543214      18-JUL-87
Ahmedabad


CUSTOMER_ID CUSTOMER_NAME
----------- --------------------------------------------------
EMAIL
--------------------------------------------------------------------------------
PHONE_NO        DOB
--------------- ---------
ADDRESS
--------------------------------------------------------------------------------
        106 Anjali Das
anjali@gmail.com
9876543215      25-JAN-05
Kolkata


CUSTOMER_ID CUSTOMER_NAME
----------- --------------------------------------------------
EMAIL
--------------------------------------------------------------------------------
PHONE_NO        DOB
--------------- ---------
ADDRESS
--------------------------------------------------------------------------------
        107 Karan Mehta
karan@gmail.com
9876543216      30-JAN-95
Pune


CUSTOMER_ID CUSTOMER_NAME
----------- --------------------------------------------------
EMAIL
--------------------------------------------------------------------------------
PHONE_NO        DOB
--------------- ---------
ADDRESS
--------------------------------------------------------------------------------
        108 Meera Nair
meera@gmail.com
9876543217      22-APR-07
Kochi


CUSTOMER_ID CUSTOMER_NAME
----------- --------------------------------------------------
EMAIL
--------------------------------------------------------------------------------
PHONE_NO        DOB
--------------- ---------
ADDRESS
--------------------------------------------------------------------------------
        109 Rohan Gupta
rohan@gmail.com
9876543218      19-DEC-08
Delhi


CUSTOMER_ID CUSTOMER_NAME
----------- --------------------------------------------------
EMAIL
--------------------------------------------------------------------------------
PHONE_NO        DOB
--------------- ---------
ADDRESS
--------------------------------------------------------------------------------
        110 Divya Iyer
divya@gmail.com
9876543219      16-JUN-09
Coimbatore


10 rows selected.

SQL> delete from customer
  2   where customer_id = 110;

1 row deleted.

SQL> select *
  2    from customer;

CUSTOMER_ID CUSTOMER_NAME
----------- --------------------------------------------------
EMAIL
--------------------------------------------------------------------------------
PHONE_NO        DOB
--------------- ---------
ADDRESS
--------------------------------------------------------------------------------
        101 Arun Raj
arunraj@gmail.com
9876543210      12-MAY-98
Chennai


CUSTOMER_ID CUSTOMER_NAME
----------- --------------------------------------------------
EMAIL
--------------------------------------------------------------------------------
PHONE_NO        DOB
--------------- ---------
ADDRESS
--------------------------------------------------------------------------------
        102 Priya Sharma
priya@gmail.com
9876543211      19-AUG-99
Bangalore


CUSTOMER_ID CUSTOMER_NAME
----------- --------------------------------------------------
EMAIL
--------------------------------------------------------------------------------
PHONE_NO        DOB
--------------- ---------
ADDRESS
--------------------------------------------------------------------------------
        103 Rahul Singh
rahul@gmail.com
9876543212      17-MAR-97
Hyderabad


CUSTOMER_ID CUSTOMER_NAME
----------- --------------------------------------------------
EMAIL
--------------------------------------------------------------------------------
PHONE_NO        DOB
--------------- ---------
ADDRESS
--------------------------------------------------------------------------------
        104 Sneha Reddy
sneha@gmail.com
9876543213      20-NOV-10
Mumbai


CUSTOMER_ID CUSTOMER_NAME
----------- --------------------------------------------------
EMAIL
--------------------------------------------------------------------------------
PHONE_NO        DOB
--------------- ---------
ADDRESS
--------------------------------------------------------------------------------
        105 Vikram Patel
vikram@gmail.com
9876543214      18-JUL-87
Ahmedabad


CUSTOMER_ID CUSTOMER_NAME
----------- --------------------------------------------------
EMAIL
--------------------------------------------------------------------------------
PHONE_NO        DOB
--------------- ---------
ADDRESS
--------------------------------------------------------------------------------
        106 Anjali Das
anjali@gmail.com
9876543215      25-JAN-05
Kolkata


CUSTOMER_ID CUSTOMER_NAME
----------- --------------------------------------------------
EMAIL
--------------------------------------------------------------------------------
PHONE_NO        DOB
--------------- ---------
ADDRESS
--------------------------------------------------------------------------------
        107 Karan Mehta
karan@gmail.com
9876543216      30-JAN-95
Pune


CUSTOMER_ID CUSTOMER_NAME
----------- --------------------------------------------------
EMAIL
--------------------------------------------------------------------------------
PHONE_NO        DOB
--------------- ---------
ADDRESS
--------------------------------------------------------------------------------
        108 Meera Nair
meera@gmail.com
9876543217      22-APR-07
Kochi


CUSTOMER_ID CUSTOMER_NAME
----------- --------------------------------------------------
EMAIL
--------------------------------------------------------------------------------
PHONE_NO        DOB
--------------- ---------
ADDRESS
--------------------------------------------------------------------------------
        109 Rohan Gupta
rohan@gmail.com
9876543218      19-DEC-08
Delhi


9 rows selected.

SQL> commit;

Commit complete.